<?xml version="1.0"?>
<users
xmlns="http://www.2s2h.com"
xmlns:xsd="http://www.w3.org/2001/XMLSchema-instance"
xsd:schemaLocation="http://www.2s2h.com login.xsd">
  <user>
    <name>Andrej</name>
    <surname>kaplosky</surname>
    <email>and@elis.it</email>
    <nick>prok</nick>
    <password>asfdasd</password>
  </user>
  <user>
    <name>Kevin</name>
    <surname>Luprois</surname>
    <email>port@elis.it</email>
    <nick>Alies</nick>
    <password>acfsd</password>
  </user>
</users>